{
  "task_id": "pilot.isolated-feature",
  "outcome": "complete",
  "finding_or_change": "Governance simulation confirmed that the isolated feature packet routes to one subsystem and one writer; no product files were changed.",
  "evidence": ["task packet schema validation", "path-ownership validation"],
  "changed_paths": [],
  "focused_validation": ["Validated the example packet against task-packet.schema.json."],
  "full_validation": [],
  "unresolved_risks": ["A real feature pilot remains dependent on a future owner-requested feature."],
  "authority_or_approval_used": "Repository-governance implementation requested by the owner; no external authority used.",
  "recommended_next_action": "Use this packet shape for the next isolated feature and record actual efficiency proxies."
}
