{
  "task_id": "pilot.release-readiness",
  "outcome": "complete",
  "finding_or_change": "Governance simulation confirmed that release readiness and publication are separate tasks and that the release steward cannot publish.",
  "evidence": ["release_steward prohibited actions", "publication approval validator"],
  "changed_paths": [],
  "focused_validation": ["Validated the example packet and role compatibility."],
  "full_validation": [],
  "unresolved_risks": ["A real release pilot remains dependent on a future local candidate."],
  "authority_or_approval_used": "Repository-governance implementation requested by the owner; no publication authority used.",
  "recommended_next_action": "Use a separate owner-approved publish packet only after a future candidate passes release review."
}
